<?xml version="1.0" encoding="UTF-8"?>
<cwb:patient xmlns:cwb="http://www.cambeeler.com/Patient"
             xmlns:xsi="http://www.w3.org/2001/XMLSchema-instance"
             xsi:schemaLocation="http://www.cambeeler.com/Patient Patient.xsd ">
  <cwb:id>2</cwb:id>
  <cwb:name>Cameron Beeler</cwb:name>
  <cwb:age>50</cwb:age>
  <cwb:dob>1968-01-25</cwb:dob>
  <cwb:email>cameron.beeler@gmail.com</cwb:email>
  <cwb:gender>M</cwb:gender>
  <cwb:phone>4792505466</cwb:phone>
  <cwb:payment>
    <cwb:cash>125</cwb:cash>
  </cwb:payment>
  <cwb:any>stuff stuff</cwb:any>
</cwb:patient>
